{
  "request_id": "REQ_PRODUCT_ITEMS_001",
  "company_id": "COMPANY_003",
  "status": "generated",
  "homepage_type": "product",
  "template_id": "product_basic",
  "generated_path": "generated-sites/COMPANY_003",
  "homepage_url": "/homepage/COMPANY_003",
  "model_provider": "local_placeholder",
  "model_name": "deterministic-template",
  "generated_files": [
    "agent-run-report.json",
    "agent-run-report.md",
    "assets.json",
    "content.json",
    "generation-result.json",
    "index.html",
    "metadata.json",
    "page.tsx",
    "styles.css",
    "validation-report.json"
  ],
  "build_result": {
    "passed": true,
    "command": "npm run build",
    "errors": []
  },
  "validation_result": {
    "passed": true,
    "errors": [],
    "warnings": []
  },
  "retry_count": 1,
  "completed_at": "2026-05-17T05:23:45.167Z"
}