{
  "request_id": "REQ_HISTORY_001",
  "company_id": "COMPANY_HISTORY_TEST",
  "status": "manual_required",
  "homepage_type": "company_intro",
  "template_id": "company_intro_basic",
  "generated_path": "generated-sites/COMPANY_HISTORY_TEST",
  "homepage_url": "/homepage/COMPANY_HISTORY_TEST",
  "model_provider": "local_placeholder",
  "model_name": "deterministic-template",
  "generated_files": [
    "assets.json",
    "content.json",
    "generation-result.json",
    "index.html",
    "metadata.json",
    "page.tsx",
    "styles.css",
    "validation-report.json"
  ],
  "build_result": {
    "passed": false,
    "command": "npm run build",
    "errors": [
      "generated site validation failed"
    ]
  },
  "validation_result": {
    "passed": false,
    "errors": [
      "page.tsx missing data-section for content section: history",
      "page.tsx missing data-section for content section: portfolio",
      "index.html missing data-section for content section: history",
      "index.html missing data-section for content section: portfolio"
    ],
    "warnings": []
  },
  "retry_count": 3,
  "completed_at": "2026-05-16T15:35:38.895Z",
  "error_type": "validation_failed",
  "errors": [
    "generated site validation failed"
  ]
}