{
  "request_id": "REQ_FAKE_CLAIM_001",
  "company_id": "COMPANY_FAKE_CLAIM",
  "status": "manual_required",
  "homepage_type": "company_intro",
  "template_id": "company_intro_basic",
  "generated_path": "generated-sites/COMPANY_FAKE_CLAIM",
  "homepage_url": "/homepage/COMPANY_FAKE_CLAIM",
  "model_provider": "local_placeholder",
  "model_name": "deterministic-template",
  "generated_files": [
    "agent-run-report.json",
    "agent-run-report.md",
    "assets.json",
    "content.json",
    "generation-result.json",
    "index.html",
    "metadata.json",
    "page.tsx",
    "styles.css",
    "validation-report.json"
  ],
  "build_result": {
    "passed": false,
    "command": "npm run build",
    "errors": [
      "generated site validation failed"
    ]
  },
  "validation_result": {
    "passed": false,
    "errors": [
      "core_strengths count must match request.core_strengths",
      "Unsupported high-risk phrase found: 업계 1위",
      "Unsupported high-risk phrase found: 수상 경력"
    ],
    "warnings": []
  },
  "retry_count": 1,
  "completed_at": "2026-05-23T16:17:07.137Z",
  "error_type": "validation_failed",
  "errors": [
    "generated site validation failed"
  ]
}